[
 {
  "cle": "Entreprise 002|strategy and operations analyst",
  "entreprise": "Entreprise 002",
  "poste": "Strategy & Operations Analyst",
  "famille": "Sales Ops",
  "dossier_deja_ouvert": false,
  "couverture": [
   {
    "exigence": "5 ans et plus d'experience en Strategy & Operations, avec un historique de mise a l'echelle d'operations",
    "preuve": "« oct. 2023 - mai 2026 (2 ans 8 mois en operations) »",
    "etat": "partiel",
    "centrale": true
   },
   {
    "exigence": "Traduire des initiatives strategiques en plans operationnels executables, avec impact mesurable",
    "preuve": "« process en 23 etapes, 143 dossiers, 2 h -> 30 min par dossier, forte reduction des erreurs, conformite systematique »",
    "etat": "couvert",
    "centrale": true
   },
   {
    "exigence": "Concevoir et etablir des cadres operationnels scalables, roadmaps operationnelles avec le leadership produit",
    "preuve": "« Cycle de vente construit sans playbook » et « CRM (Digiforma) deploye de bout en bout »",
    "etat": "couvert",
    "centrale": true
   },
   {
    "exigence": "Analyses quantitatives et qualitatives pour identifier opportunites de marche et inefficacites operationnelles",
    "preuve": "« Reporting 20 M EUR de CA (Carrefour, Cora) sous Power BI et SAP ; 200+ SKU »",
    "etat": "couvert",
    "centrale": true
   },
   {
    "exigence": "Maitrise de SQL (ou volonte d'apprendre) et des outils modernes d'analyse de donnees",
    "preuve": "« SQL : Kaggle Intro et Advanced SQL ; base Postgres (Supabase) en production sur Mentalizi ; requetes generees par l'IA puis lues et validees. Jamais SQL avance »",
    "etat": "partiel",
    "centrale": false
   },
   {
    "exigence": "Piloter des projets transverses complexes avec de multiples parties prenantes et priorites concurrentes",
    "preuve": "« coordination de 5 personnes sans lien hierarchique »",
    "etat": "couvert",
    "centrale": true
   },
   {
    "exigence": "Etre le point d'orchestration entre la track et les equipes horizontales (care, sales, autres equipes produit)",
    "preuve": "« coordination de 5 personnes sans lien hierarchique » et « 20 entreprises clientes, 40 % converties sur une offre additionnelle »",
    "etat": "couvert",
    "centrale": false
   },
   {
    "exigence": "Posseder le processus OKR de la track et les mecanismes de suivi de la performance",
    "preuve": "« Reporting 20 M EUR de CA (Carrefour, Cora) sous Power BI et SAP » ; aucun processus OKR dans rules/profil.md",
    "etat": "partiel",
    "centrale": true
   },
   {
    "exigence": "Communication et influence : articuler des concepts complexes et convaincre des interlocuteurs varies",
    "preuve": "« Consultant & Formateur (freelance) | PME | mai 2021 - sept. 2022 | ... formation d'adultes »",
    "etat": "couvert",
    "centrale": false
   },
   {
    "exigence": "Etre courant en francais et en anglais",
    "preuve": "« Francais natif, anglais courant (910 TOEIC) »",
    "etat": "couvert",
    "centrale": false
   }
  ],
  "score_couverture_10": 8.5,
  "score_conditions_3": 2,
  "score_entreprise_4": 4,
  "score_differenciateurs_3": 0,
  "note_20": 14,
  "verdict": "veille",
  "raison_principale": "Ecosysteme et entreprise au maximum (4/4) et couverture des missions tres bonne, mais l'annonce demande 5 ans et plus en Strategy & Operations quand Tom en a 2 ans 8 mois, et ne demande aucun des trois differenciateurs de la grille.",
  "exigences_sans_preuve": [
   "5 ans et plus d'experience en Strategy & Operations : preuve partielle seulement, 2 ans 8 mois en operations",
   "Processus OKR possede de bout en bout : preuve partielle seulement, aucun OKR dans rules/profil.md",
   "Maitrise de SQL et outils modernes d'analyse : preuve partielle seulement, jamais SQL avance"
  ],
  "deductions": "[texte retiré de la version publique]",
  "detail": "[texte retiré de la version publique]",
  "regles_appliquees": [
   "R2",
   "R3",
   "R7",
   "R8",
   "R9"
  ],
  "run": "2026-09-07 14:00"
 },
 {
  "cle": "Entreprise 043|compliance ops builder",
  "entreprise": "Entreprise 043",
  "poste": "Compliance Ops Builder",
  "famille": "Sales Ops",
  "dossier_deja_ouvert": true,
  "couverture": [
   {
    "exigence": "Avoir transforme du travail manuel et repetitif en solutions automatisees ou self-serve avec des outils no-code, low-code et IA",
    "preuve": "« workflows n8n et Process Street (relances, declencheurs, scoring, webhooks et API vers le CRM, gestion d'erreurs) »",
    "etat": "couvert",
    "centrale": true
   },
   {
    "exigence": "Avoir construit des choses que les gens ont continue d'utiliser",
    "preuve": "« CRM (Digiforma) deploye de bout en bout »",
    "etat": "couvert",
    "centrale": true
   },
   {
    "exigence": "Reconstruire des processus de bout en bout, rester dessus apres le lancement et les ameliorer jusqu'a l'adoption",
    "preuve": "« process en 23 etapes, 143 dossiers, 2 h -> 30 min par dossier »",
    "etat": "couvert",
    "centrale": true
   },
   {
    "exigence": "Posseder au moins un process du probleme jusqu'a une solution automatisee, vivante et reellement utilisee",
    "preuve": "« workflows n8n et Process Street (relances, declencheurs, scoring, webhooks et API vers le CRM, gestion d'erreurs) »",
    "etat": "couvert",
    "centrale": true
   },
   {
    "exigence": "Mesurer ce qui est livre : fixer des objectifs clairs et les verifier",
    "preuve": "« 2 h -> 30 min par dossier, forte reduction des erreurs, conformite systematique »",
    "etat": "couvert",
    "centrale": false
   },
   {
    "exigence": "Appetence pour le travail regule et jugement sur les exigences legales, privacy, securite et conformite",
    "preuve": "« forte reduction des erreurs, conformite systematique » ; aucune experience juridique, privacy ou securite dans rules/profil.md",
    "etat": "partiel",
    "centrale": true
   },
   {
    "exigence": "Pilotage de projet de bout en bout, de la recherche utilisateur et de la planification jusqu'a la livraison et l'adoption",
    "preuve": "« Cycle de vente construit sans playbook » et « coordination de 5 personnes sans lien hierarchique »",
    "etat": "couvert",
    "centrale": true
   },
   {
    "exigence": "Communication claire et proactive avec les parties prenantes",
    "preuve": "« Consultant & Formateur (freelance) | PME | mai 2021 - sept. 2022 | ... formation d'adultes »",
    "etat": "couvert",
    "centrale": false
   },
   {
    "exigence": "Builder mindset : avancer vite et en autonomie, prioriser, tester en avancant, livrer plutot que polir",
    "preuve": "« President-Fondateur | Hack'Coeur (association) | 2020 | Creee a partir de rien, partenariats et benevoles ; incubee a l'INSEAD »",
    "etat": "couvert",
    "centrale": false
   },
   {
    "exigence": "Francais et anglais de niveau professionnel",
    "preuve": "« Francais natif, anglais courant (910 TOEIC) »",
    "etat": "couvert",
    "centrale": false
   }
  ],
  "score_couverture_10": 9.5,
  "score_conditions_3": 2,
  "score_entreprise_4": 2,
  "score_differenciateurs_3": 1,
  "note_20": 14,
  "verdict": "dossier_ouvert",
  "raison_principale": "Le coeur du poste, construire et automatiser des process de bout en bout avec des outils no-code et IA, est exactement ce que Tom a fait chez CITYZ'Formation ; l'entreprise ne rapporte que 2 des 4 points (secteur sante hors ecosystemes de la grille, aucune note Glassdoor citee) et un dossier est deja ouvert chez Entreprise 043.",
  "exigences_sans_preuve": [
   "Appetence et experience du travail regule (legal, privacy, gouvernance, risque, conformite, securite) : preuve partielle seulement, la conformite systematique chez CITYZ'Formation ne couvre pas ce perimetre"
  ],
  "deductions": "[texte retiré de la version publique]",
  "detail": "[texte retiré de la version publique]",
  "regles_appliquees": [
   "R3",
   "R7",
   "R8",
   "R9"
  ],
  "run": "2026-09-07 14:00"
 },
 {
  "cle": "Entreprise 052|enablement lead programs",
  "entreprise": "Entreprise 052",
  "poste": "Enablement Lead, Programs",
  "famille": "Sales Ops",
  "dossier_deja_ouvert": true,
  "couverture": [
   {
    "exigence": "5 a 8 ans et plus en enablement, revenue programs, pre-sales ou sales operations",
    "preuve": "« oct. 2023 - mai 2026 (2 ans 8 mois en operations) »",
    "etat": "partiel",
    "centrale": true
   },
   {
    "exigence": "Builder prouve : avoir concu des systemes d'enablement scalables et pas seulement les avoir executes",
    "preuve": "« process en 23 etapes, 143 dossiers, 2 h -> 30 min par dossier »",
    "etat": "couvert",
    "centrale": true
   },
   {
    "exigence": "Posseder l'architecture de curriculum, les cadres de certification et les programmes terrain pour Account Executives et Deployment Strategists",
    "preuve": "« Consultant & Formateur (freelance) | PME | mai 2021 - sept. 2022 | ... formation d'adultes » ; aucun curriculum ni cadre de certification commercial dans rules/profil.md",
    "etat": "partiel",
    "centrale": true
   },
   {
    "exigence": "Fluidite GTM : comprehension profonde des cycles de vente entreprise, des systemes CRM et des stage gates",
    "preuve": "« Ingenieur d'affaires | 5 Degres (ESN) | 360 k EUR de CA, 120 % des objectifs, 180 k EUR par compte ouvert (2 comptes), SNCF Connect & Tech ; pipeline sur BoondManager »",
    "etat": "couvert",
    "centrale": true
   },
   {
    "exigence": "Piloter le moteur operationnel : cadence terrain bi-hebdomadaire avec Produit et Marketing, propriete du SKO",
    "preuve": "« coordination de 5 personnes sans lien hierarchique » ; aucun SKO ni cadence terrain dans rules/profil.md",
    "etat": "partiel",
    "centrale": true
   },
   {
    "exigence": "Fixer la barre de qualite : des evaluations qui prouvent la competence et pas la presence",
    "preuve": "« Consultant & Formateur (freelance) | PME | mai 2021 - sept. 2022 | ... formation d'adultes »",
    "etat": "partiel",
    "centrale": false
   },